{
  "contract_name": "worker.channel.envelope",
  "contract_version": "1.0.0",
  "schema_version": "1.0.0",
  "taxonomy_version": "taxonomy-recon-v1",
  "tenant_id": "tenant-lab-001",
  "customer_context_id": "customer-context-main",
  "environment": "phase0_lab",
  "correlation_id": "corr:message-registration-001",
  "causation_id": null,
  "idempotency_key": "channel:message-registration-001",
  "producer": {
    "component": "worker",
    "produced_at": "2026-07-25T05:00:00Z"
  },
  "policy_version": "policy-phase0-v1",
  "message_id": "message-registration-001",
  "worker_id": "arc-worker-001",
  "message_type": "registration",
  "key_id": "lab-key-001",
  "nonce": "00112233445566778899aabbccddeeff",
  "payload_hash": "sha256:aaaaaaaaaaaaaaaaaaaaaaaaaaaaaaaaaaaaaaaaaaaaaaaaaaaaaaaaaaaaaaaa",
  "signature_algorithm": "hmac-sha256",
  "signature": "bbbbbbbbbbbbbbbbbbbbbbbbbbbbbbbbbbbbbbbbbbbbbbbbbbbbbbbbbbbbbbbb",
  "issued_at": "2026-07-25T05:00:00Z",
  "expires_at": "2026-07-25T05:01:00Z"
}
